{
  "$schema": "./topic.schema.json",
  "version": 1,
  "name": "rom-sciml-twins",
  "arxiv": {
    "search_query": "(all:\"reduced order\" OR all:\"reduced-order\" OR all:\"model order reduction\" OR all:\"scientific machine learning\" OR all:\"physics-informed\" OR all:\"neural operator\" OR all:\"operator learning\" OR all:\"surrogate model\" OR all:\"digital twin\" OR all:\"digital twins\" OR all:\"POD-Galerkin\" OR all:\"hyper-reduction\" OR all:\"DeepONet\" OR all:\"Fourier neural operator\")"
  },
  "theme": {
    "disabled": false,
    "patterns": [
      {
        "pattern": "digital\\s+twins?",
        "weight": 3
      },
      {
        "pattern": "virtual\\s+twins?",
        "weight": 3
      },
      {
        "pattern": "reduced[-\\s]?order",
        "weight": 3
      },
      {
        "pattern": "model\\s+order\\s+reduction",
        "weight": 3
      },
      {
        "pattern": "scientific\\s+machine\\s+learning",
        "weight": 3
      },
      {
        "pattern": "physics[-\\s]?informed",
        "weight": 3
      },
      {
        "pattern": "physics\\s+ai|ai\\s+physics",
        "weight": 3
      },
      {
        "pattern": "\\bpinn\\b|physics[-\\s]?informed\\s+neural",
        "weight": 3
      },
      {
        "pattern": "\\bfno\\b|fourier\\s+neural\\s+operator",
        "weight": 3
      },
      {
        "pattern": "\\bdeeponet\\b|neural\\s+operator",
        "weight": 3
      },
      {
        "pattern": "surrogate\\s+model",
        "weight": 3
      },
      {
        "pattern": "operator\\s+learning",
        "weight": 3
      },
      {
        "pattern": "\\bsciml\\b|sci[-\\s]?ml",
        "weight": 3
      },
      {
        "pattern": "\\bpod\\b|proper\\s+orthogonal\\s+decomposition",
        "weight": 2
      },
      {
        "pattern": "\\brom\\b",
        "weight": 2
      },
      {
        "pattern": "physics[-\\s]based\\s+simulation|multiphysics",
        "weight": 2
      },
      {
        "pattern": "\\bcae\\b|finite\\s+element|\\bcfd\\b",
        "weight": 2
      },
      {
        "pattern": "simcenter|twin\\s+builder|omniverse|modulus",
        "weight": 2
      },
      {
        "pattern": "predictive\\s+simulation|simulation\\s+software",
        "weight": 2
      },
      {
        "pattern": "physics\\s+ml|physics[-\\s]based\\s+ml",
        "weight": 2
      },
      {
        "pattern": "continuous\\s+physics|physics\\s+intelligence|physics\\s+as\\s+infrastructure",
        "weight": 2
      },
      {
        "pattern": "surrogate|emulator",
        "weight": 2
      },
      {
        "pattern": "calibration|parameter\\s+inference",
        "weight": 1
      },
      {
        "pattern": "\\bai[-\\s]driven\\s+engineering|engineering\\s+ai",
        "weight": 1
      },
      {
        "pattern": "simulation|numerical\\s+model",
        "weight": 1
      }
    ]
  },
  "compose": {
    "editor_intro": "You are an editor writing a concise weekly briefing for engineers and researchers working in reduced-order modeling (ROM), scientific machine learning (SciML), and digital twins.",
    "subject_rules": "Subject line (\"subject\" field):\n- Under 90 characters. Lead with the week's strongest industry/vendor angles when the Industry News excerpts support them; only foreground research paper titles when industry material is thin.\n- Do NOT use generic series boilerplate such as \"ROM/SciML Weekly\", \"ROM / SciML\", or \"ROM, SciML, and digital twins weekly\". Write a concrete headline (e.g. product/partnership themes, simulation platforms) instead.",
    "classification_block": "Classification (pre-split inputs):\n- The **Research Papers excerpts** block below is tagged from sources as academic/papers (e.g. arXiv). Base \"research_papers\" ONLY on that block. Do not move vendor press into research unless it clearly appears there.\n- The **Industry News excerpts** block is tagged from sources as industry/vendor. Base \"industry_news\" ONLY on that block.\n- Put arXiv/preprints and academic items under \"research_papers\" using only URLs from the Research Papers block.\n- Put vendor press, product news, blogs, and commercial announcements under \"industry_news\" **only when** the excerpt clearly relates to our themes: reduced-order modeling, SciML, physics-informed / physics-based ML, neural operators / surrogates, digital or virtual twins, CAE/simulation platforms (e.g. twin builder, Omniverse, Modulus, Simcenter), or AI applied to engineering simulation / physics.\n- **Omit** industry subsections about unrelated topics (e.g. pure clinical trials with no simulation angle, generic enterprise IT, consumer hardware) unless the excerpt explicitly ties to simulation, twins, or physics/CAE AI.\n- Prefer fewer, stronger industry subsections over padding with weak matches.\n- Each of \"research_papers\" and \"industry_news\" must have between 0 and 5 subsections (inclusive); use 0 when there are no relevant excerpts.\n- Each subsection's \"links\" should list the 1-3 most relevant URLs from the excerpts that support it (URLs must appear in the corresponding block).",
    "refine_system_extra": "Preserve subject-line rules: no \"ROM/SciML Weekly\"-style boilerplate; industry-led subject when excerpts support it."
  },
  "sections": {
    "industry_heading": "Industry News",
    "research_heading": "Research Papers"
  },
  "buttondown": {
    "fallback_subject": "Weekly \u2014 simulation AI & digital twins"
  }
}
